{
  "payer": "Aetna",
  "effective_date": "2026-01-01",
  "source_note": "Patterns in public Aetna clinical-policy bulletins (CPBs) as of 2025; SIMULATED — not authoritative.",
  "procedures": [
    {
      "cpt_code": "93015",
      "description": "Cardiovascular stress test, treadmill, physician-supervised",
      "prior_auth_required": false,
      "required_documents": [
        "Order with ICD-10",
        "Appropriate-use indication"
      ],
      "typical_turnaround_business_days": 0,
      "common_denial_reasons": [
        "indication does not match appropriate-use criteria",
        "duplicate within 60 days"
      ],
      "notes": "Post-payment review on indication match."
    },
    {
      "cpt_code": "93306",
      "description": "Transthoracic echocardiogram",
      "prior_auth_required": false,
      "required_documents": [
        "Order with ICD-10",
        "Indication and question to be answered"
      ],
      "typical_turnaround_business_days": 0,
      "common_denial_reasons": [
        "repeat within 6 months without interval change"
      ],
      "notes": "Frequency criterion: max one per 6 months for stable conditions absent interval change."
    },
    {
      "cpt_code": "93458",
      "description": "Catheter placement in coronary arteries with contrast injection(s)",
      "prior_auth_required": true,
      "required_documents": [
        "Full non-invasive testing report (stress, MPI, or CTA)",
        "Symptom history",
        "Cardiac risk factors",
        "Recent ECG"
      ],
      "typical_turnaround_business_days": [5, 7],
      "common_denial_reasons": [
        "no high-risk findings on non-invasive study",
        "indication outside Class I/IIa AUC",
        "incomplete prior-study documentation"
      ],
      "notes": "Aetna CPB requires high-risk noninvasive findings or class I/IIa AUC."
    },
    {
      "cpt_code": "93620",
      "description": "Comprehensive electrophysiologic evaluation",
      "prior_auth_required": true,
      "required_documents": [
        "Documented arrhythmia",
        "Symptom statement",
        "Pharmacologic-therapy failure or contraindication"
      ],
      "typical_turnaround_business_days": [5, 10],
      "common_denial_reasons": [
        "no documented arrhythmia",
        "no prior pharmacologic trial"
      ],
      "notes": "Wider turnaround variance vs. UPMC/Highmark."
    },
    {
      "cpt_code": "93224",
      "description": "48-hour external electrocardiographic recording",
      "prior_auth_required": false,
      "required_documents": [
        "Order with ICD-10",
        "Symptom-correlation rationale"
      ],
      "typical_turnaround_business_days": 0,
      "common_denial_reasons": [
        "duration mismatch — extended monitoring (>7d) uses different CPT and needs PA"
      ],
      "notes": "Aetna caps duration; extended monitoring uses 93241-93248 and requires PA."
    }
  ]
}
