{
  "payer": "Cigna",
  "effective_date": "2026-01-01",
  "source_note": "Patterns in public Cigna commercial coverage policies as of 2025; SIMULATED — not authoritative. EviCore handles cardiology PA.",
  "procedures": [
    {
      "cpt_code": "93015",
      "description": "Cardiovascular stress test, treadmill, physician-supervised",
      "prior_auth_required": false,
      "required_documents": [
        "Order with ICD-10"
      ],
      "typical_turnaround_business_days": 0,
      "common_denial_reasons": [
        "billed with 93017 (nuclear) without PA"
      ],
      "notes": "Bare treadmill only. Nuclear-stress combined billing requires PA via EviCore."
    },
    {
      "cpt_code": "93306",
      "description": "Transthoracic echocardiogram",
      "prior_auth_required": false,
      "required_documents": [
        "Order with ICD-10",
        "Indication"
      ],
      "typical_turnaround_business_days": 0,
      "common_denial_reasons": [
        "repeat within 6 months without interval change"
      ],
      "notes": "Cigna applies a 6-month repeat-frequency rule."
    },
    {
      "cpt_code": "93458",
      "description": "Catheter placement in coronary arteries with contrast injection(s)",
      "prior_auth_required": true,
      "required_documents": [
        "Prior non-invasive study FULL report",
        "CCS class (angina) or NYHA class (HF), as appropriate",
        "Risk-stratification rationale tied to ACC/AHA AUC",
        "Recent ECG"
      ],
      "typical_turnaround_business_days": [4, 7],
      "common_denial_reasons": [
        "non-invasive summary instead of full report",
        "missing CCS / NYHA class",
        "indication outside Class I/IIa AUC"
      ],
      "notes": "EviCore portal pends on any checklist gap; resubmit-with-missing-doc adds 1-2 days."
    },
    {
      "cpt_code": "93620",
      "description": "Comprehensive electrophysiologic evaluation",
      "prior_auth_required": true,
      "required_documents": [
        "Arrhythmia documentation with mechanism",
        "Failed or contraindicated AAD trial",
        "Symptom-severity statement"
      ],
      "typical_turnaround_business_days": [5, 8],
      "common_denial_reasons": [
        "no mechanism-specific arrhythmia documentation",
        "no AAD trial",
        "asymptomatic patient"
      ],
      "notes": "EviCore review."
    },
    {
      "cpt_code": "93224",
      "description": "48-hour external electrocardiographic recording",
      "prior_auth_required": false,
      "required_documents": [
        "Order with ICD-10",
        "Symptom-correlation rationale"
      ],
      "typical_turnaround_business_days": 0,
      "common_denial_reasons": [
        "missing symptom-correlation rationale on post-payment review"
      ],
      "notes": "Post-payment review on indication."
    }
  ]
}
